{
    "updateConfig": {
        "updateChannel": "ScamJamBroad",
        "automaticUpdatesEnabled": true
    },
    "securityConfig": {
        "windowsAppLocker": false,
        "dnsClient": true,
        "commandLine": true,
        "networkPorts": true,
        "windowsAuthenticodeCommonName": true,
        "productName": true
    },
    "userAllowlistsConfig": {
        "userDnsAllowlist": [
            
        ],
        "userCommandLineAllowlist": [
            
        ]
    },
    "userBlocklistsConfig": {
        "userDnsBlocklist": [
            
        ],
        "userCommandLineBlocklist": [
            
        ]
    }
}